{
  "generated" : "2026-10-26",
  "golden" : "target/synth/golden/cashbook.jsonl",
  "period" : "2026-10:2027-03",
  "modes" : [ {
    "mode" : "rules",
    "classifier" : "rules only",
    "notRun" : null,
    "score" : {
      "goldenLines" : 81,
      "actualLines" : 73,
      "matched" : 72,
      "wrongCode" : 0,
      "missing" : 9,
      "extra" : 1,
      "accuracy" : 0.8888888888888888,
      "ruleDecidedLines" : 53,
      "ruleDecidedCorrect" : 53,
      "goldenGstCollected" : 8100.00,
      "actualGstCollected" : 8100.00,
      "gstCollectedDiff" : 0.00,
      "goldenGstClaimed" : 1981.47,
      "actualGstClaimed" : 1531.80,
      "gstClaimedDiff" : -449.67,
      "gstWithinTolerance" : false,
      "codes" : [ {
        "code" : "707",
        "goldenLines" : 7,
        "actualLines" : 7,
        "matched" : 7,
        "precision" : 1.0,
        "recall" : 1.0,
        "goldenAmount" : 62100.00,
        "actualAmount" : 62100.00,
        "difference" : 0.00
      }, {
        "code" : "710",
        "goldenLines" : 5,
        "actualLines" : 5,
        "matched" : 5,
        "precision" : 1.0,
        "recall" : 1.0,
        "goldenAmount" : -25.00,
        "actualAmount" : -25.00,
        "difference" : 0.00
      }, {
        "code" : "711",
        "goldenLines" : 2,
        "actualLines" : 2,
        "matched" : 2,
        "precision" : 1.0,
        "recall" : 1.0,
        "goldenAmount" : -1725.00,
        "actualAmount" : -1725.00,
        "difference" : 0.00
      }, {
        "code" : "724",
        "goldenLines" : 6,
        "actualLines" : 6,
        "matched" : 6,
        "precision" : 1.0,
        "recall" : 1.0,
        "goldenAmount" : -14400.00,
        "actualAmount" : -14400.00,
        "difference" : 0.00
      }, {
        "code" : "725",
        "goldenLines" : 6,
        "actualLines" : 6,
        "matched" : 6,
        "precision" : 1.0,
        "recall" : 1.0,
        "goldenAmount" : -778.93,
        "actualAmount" : -778.93,
        "difference" : 0.00
      }, {
        "code" : "726",
        "goldenLines" : 6,
        "actualLines" : 1,
        "matched" : 0,
        "precision" : 0.0,
        "recall" : 0.0,
        "goldenAmount" : -535.50,
        "actualAmount" : -46.50,
        "difference" : 489.00
      }, {
        "code" : "727",
        "goldenLines" : 6,
        "actualLines" : 6,
        "matched" : 6,
        "precision" : 1.0,
        "recall" : 1.0,
        "goldenAmount" : -530.19,
        "actualAmount" : -530.19,
        "difference" : 0.00
      }, {
        "code" : "728",
        "goldenLines" : 6,
        "actualLines" : 6,
        "matched" : 6,
        "precision" : 1.0,
        "recall" : 1.0,
        "goldenAmount" : -390.00,
        "actualAmount" : -390.00,
        "difference" : 0.00
      }, {
        "code" : "729",
        "goldenLines" : 6,
        "actualLines" : 6,
        "matched" : 6,
        "precision" : 1.0,
        "recall" : 1.0,
        "goldenAmount" : -164.60,
        "actualAmount" : -164.60,
        "difference" : 0.00
      }, {
        "code" : "730",
        "goldenLines" : 6,
        "actualLines" : 6,
        "matched" : 6,
        "precision" : 1.0,
        "recall" : 1.0,
        "goldenAmount" : -289.20,
        "actualAmount" : -289.20,
        "difference" : 0.00
      }, {
        "code" : "732",
        "goldenLines" : 1,
        "actualLines" : 1,
        "matched" : 1,
        "precision" : 1.0,
        "recall" : 1.0,
        "goldenAmount" : -1240.00,
        "actualAmount" : -1240.00,
        "difference" : 0.00
      }, {
        "code" : "733",
        "goldenLines" : 2,
        "actualLines" : 2,
        "matched" : 2,
        "precision" : 1.0,
        "recall" : 1.0,
        "goldenAmount" : -6339.37,
        "actualAmount" : -6339.37,
        "difference" : 0.00
      }, {
        "code" : "734",
        "goldenLines" : 9,
        "actualLines" : 6,
        "matched" : 6,
        "precision" : 1.0,
        "recall" : 0.6666666666666666,
        "goldenAmount" : -3198.50,
        "actualAmount" : -240.00,
        "difference" : 2958.50
      }, {
        "code" : "739",
        "goldenLines" : 13,
        "actualLines" : 13,
        "matched" : 13,
        "precision" : 1.0,
        "recall" : 1.0,
        "goldenAmount" : -348.15,
        "actualAmount" : -348.15,
        "difference" : 0.00
      } ]
    },
    "stats" : {
      "reviewItems" : 16,
      "pendingLines" : 15,
      "llmCalls" : 0,
      "llmInputTokens" : 0,
      "llmOutputTokens" : 0,
      "llmMillis" : 0,
      "costNzd" : 0.0,
      "runMillis" : 2328,
      "statements" : 6,
      "statementsReconciled" : 6,
      "reconcileProblems" : [ ],
      "exportFailures" : [ ]
    },
    "matching" : {
      "matched" : [ {
        "golden" : {
          "month" : "2026-10",
          "date" : "2026-10-05",
          "code" : "725",
          "detail" : "Power - Fibrewave",
          "amount" : -153.48,
          "gstCollected" : 0.0000,
          "gstClaimed" : -20.0191,
          "source" : "KauriRewardsMastercard-05Apr27.pdf p.3",
          "ruleDecided" : false
        },
        "actual" : {
          "month" : "2026-10",
          "date" : "2026-10-05",
          "code" : "725",
          "detail" : "Power - FIBREWAVE INTERNET",
          "amount" : -153.48,
          "gstCollected" : 0.0000,
          "gstClaimed" : -20.0191,
          "source" : "KauriRewardsMastercard-05Apr27.pdf p.3",
          "ruleDecided" : true
        }
      }, {
        "golden" : {
          "month" : "2026-10",
          "date" : "2026-10-05",
          "code" : "727",
          "detail" : "Internet - Fibrewave",
          "amount" : -89.99,
          "gstCollected" : 0.0000,
          "gstClaimed" : -11.7378,
          "source" : "KauriRewardsMastercard-05Apr27.pdf p.3",
          "ruleDecided" : false
        },
        "actual" : {
          "month" : "2026-10",
          "date" : "2026-10-05",
          "code" : "727",
          "detail" : "Internet - FIBREWAVE INTERNET",
          "amount" : -89.99,
          "gstCollected" : 0.0000,
          "gstClaimed" : -11.7378,
          "source" : "KauriRewardsMastercard-05Apr27.pdf p.3",
          "ruleDecided" : true
        }
      }, {
        "golden" : {
          "month" : "2026-10",
          "date" : "2026-10-20",
          "code" : "733",
          "detail" : "Body Corp Fees - Kowhai BC levy Oct-Dec (net of early-payment discount)",
          "amount" : -3148.47,
          "gstCollected" : 0.0000,
          "gstClaimed" : -410.6700,
          "source" : "ChequeAccount-05Apr27.pdf p.4",
          "ruleDecided" : false
        },
        "actual" : {
          "month" : "2026-10",
          "date" : "2026-10-20",
          "code" : "733",
          "detail" : "4BBodyCorp-Kowhai Body-Corp L0007700010",
          "amount" : -3148.47,
          "gstCollected" : 0.0000,
          "gstClaimed" : -410.6700,
          "source" : "ChequeAccount-05Apr27.pdf p.4",
          "ruleDecided" : true
        }
      }, {
        "golden" : {
          "month" : "2026-10",
          "date" : "2026-10-02",
          "code" : "724",
          "detail" : "Apartment Rent",
          "amount" : -2400.00,
          "gstCollected" : 0.0000,
          "gstClaimed" : 0.0000,
          "source" : "BusinessEveryday-05Apr27.pdf p.4",
          "ruleDecided" : false
        },
        "actual" : {
          "month" : "2026-10",
          "date" : "2026-10-02",
          "code" : "724",
          "detail" : "4B-12 (Apartment Rent-4B-12 S000123",
          "amount" : -2400.00,
          "gstCollected" : 0.0000,
          "gstClaimed" : 0.0000,
          "source" : "BusinessEveryday-05Apr27.pdf p.4",
          "ruleDecided" : true
        }
      }, {
        "golden" : {
          "month" : "2026-10",
          "date" : "2026-10-05",
          "code" : "728",
          "detail" : "Mobile Plan - Tui Mobile NZ",
          "amount" : -65.00,
          "gstCollected" : 0.0000,
          "gstClaimed" : -8.4783,
          "source" : "BusinessEveryday-05Apr27.pdf p.4",
          "ruleDecided" : false
        },
        "actual" : {
          "month" : "2026-10",
          "date" : "2026-10-05",
          "code" : "728",
          "detail" : "Tui Mobile TM",
          "amount" : -65.00,
          "gstCollected" : 0.0000,
          "gstClaimed" : -8.4783,
          "source" : "BusinessEveryday-05Apr27.pdf p.4",
          "ruleDecided" : true
        }
      }, {
        "golden" : {
          "month" : "2026-10",
          "date" : "2026-10-15",
          "code" : "707",
          "detail" : "Income - Oct - Kereru Digital (Invoice INV-1041)",
          "amount" : 8280.00,
          "gstCollected" : 1080.0000,
          "gstClaimed" : 0.0000,
          "source" : "BusinessEveryday-05Apr27.pdf p.4",
          "ruleDecided" : false
        },
        "actual" : {
          "month" : "2026-10",
          "date" : "2026-10-15",
          "code" : "707",
          "detail" : "Kereru Digital Limited",
          "amount" : 8280.00,
          "gstCollected" : 1080.0000,
          "gstClaimed" : 0.0000,
          "source" : "BusinessEveryday-05Apr27.pdf p.4",
          "ruleDecided" : true
        }
      }, {
        "golden" : {
          "month" : "2026-10",
          "date" : "2026-10-02",
          "code" : "729",
          "detail" : "Car Park Fees",
          "amount" : -26.90,
          "gstCollected" : 0.0000,
          "gstClaimed" : -3.5087,
          "source" : "BusinessEveryday-05Apr27.pdf p.4 (+2 more)",
          "ruleDecided" : false
        },
        "actual" : {
          "month" : "2026-10",
          "date" : "2026-10-02",
          "code" : "729",
          "detail" : "Car Parking (3)",
          "amount" : -26.90,
          "gstCollected" : 0.0000,
          "gstClaimed" : -3.5087,
          "source" : "BusinessEveryday-05Apr27.pdf p.4 (+2 more)",
          "ruleDecided" : false
        }
      }, {
        "golden" : {